{
  "contrato": "CTR-09",
  "contratoVersion": 1,
  "juego": "por-la-letra",
  "modoRespuesta": "buscador",
  "actualizado": "2026-09-01",
  "sensibleA": [
    "letra"
  ],
  "filtro": {
    "regla": "CNT-11",
    "version": 6
  },
  "nota": "Lo escribe scripts/generar-por-la-letra.mjs desde el cancionero. Es la lista de lo que existe y valido contra CNT-11, no de deseos. No se edita a mano.",
  "items": [
    {
      "slug": "barbazul-versus-el-amor-letal",
      "titulo": "Barbazul versus el amor letal",
      "desde": 1,
      "versos": [
        "te va a gustar.",
        "El reo semental se va a licuar",
        "En la prisión.",
        "Gatas lindas, sirenas llenas.",
        "Camisa apretada, pezón radioactivo.",
        "Reclamando el botín para la prisión",
        "Del dios prisión feliz prisión... Del dios",
        "Barbazul de esta prisión."
      ],
      "dificultad": "dificil",
      "dificultadSegun": "youtube",
      "fuente": {
        "sitio": "lacuerda.net",
        "url": "https://acordes.lacuerda.net/patricio_rey/barba_azul_vs_el_amor_letal.shtml",
        "consultado": "2026-08-24"
      }
    },
    {
      "slug": "roto-y-mal-parado",
      "titulo": "Roto y mal parado",
      "desde": 1,
      "versos": [
        "en esta tibia, tibia fila.",
        "Quemás, Quemás, Quemás...",
        "Quemás, Quemás, Quemás... tu vida.",
        "¿Comó te vá en estos dias?",
        "¡Fuego, fuego!",
        "¡Fuego, fuego! mentiras.",
        "Tu loca voluntad humeando,",
        "graznando fiero y sin estilo."
      ],
      "dificultad": "dificil",
      "dificultadSegun": "youtube",
      "fuente": {
        "sitio": "cifraclub.com",
        "url": "https://www.cifraclub.com/los-redonditos-de-ricota/roto-y-mal-parado/",
        "consultado": "2026-08-24",
        "ficha": "RES-49"
      }
    },
    {
      "slug": "pierre-el-vitricida",
      "titulo": "Pierre, el vitricida",
      "desde": 1,
      "versos": [
        "Como se rie el gordo Pierre",
        "y rompio el vidrio el gordo Pierre",
        "como rajó el gordo Pierre",
        "y como tose el gordo Pierre, Pierre, Pierre",
        "y como se rie el gordo Pierre",
        "y como tose el gordo Pierre",
        "el vitricida el gordo Pierre",
        "y rompio el vidrio el gordo Pierre, Pierre, Pierre"
      ],
      "dificultad": "dificil",
      "dificultadSegun": "youtube",
      "fuente": {
        "sitio": "lacuerda.net",
        "url": "https://acordes.lacuerda.net/patricio_rey/pierre_el_vitricida.shtml",
        "consultado": "2026-08-24"
      }
    },
    {
      "slug": "unos-pocos-peligros-sensatos",
      "titulo": "Unos pocos peligros sensatos",
      "desde": 3,
      "versos": [
        "en la tiniebla y con los gatos.",
        "Golpe de suerte.",
        "Si vos cuidás que tu animal",
        "No nos muestre libremente",
        "Lo que ya sabe",
        "del cuento de la muerte.",
        "Todo este estúpido viaje mi amor",
        "Por los astros sólidos, sólidos bólidos"
      ],
      "dificultad": "dificil",
      "dificultadSegun": "youtube",
      "fuente": {
        "sitio": "lacuerda.net",
        "url": "https://acordes.lacuerda.net/patricio_rey/unos_pocos_peligros_sensatos.shtml",
        "consultado": "2026-08-24"
      }
    },
    {
      "slug": "yo-no-me-cai-del-cielo",
      "titulo": "Yo no me caí del cielo",
      "desde": 1,
      "versos": [
        "Nena no quiero perderte",
        "no pases de todo",
        "que no esta tan mal",
        "Pero si de un bar muy triste",
        "Nena,",
        "nena hay mucho olor a gato",
        "si quieres puedes apostar.",
        "hay alegrias y alegrias"
      ],
      "dificultad": "dificil",
      "dificultadSegun": "youtube",
      "fuente": {
        "sitio": "cifraclub.com",
        "url": "https://www.cifraclub.com/los-redonditos-de-ricota/yo-no-me-cai-del-cielo/",
        "consultado": "2026-08-24",
        "ficha": "RES-49"
      }
    },
    {
      "slug": "te-voy-a-atornillar",
      "titulo": "Te voy a atornillar",
      "desde": 4,
      "versos": [
        "POS-VERSO: (PArte B)",
        "¿Cómo puede ser que te alboroten mis placeres?",
        "Te espumo mucho.",
        "Te asfixio mucho.",
        "Te parto mucho.",
        "Te siento mucho.",
        "Yo te quisiera asaltar.",
        "Te voy a herir un poquito más."
      ],
      "dificultad": "dificil",
      "dificultadSegun": "youtube",
      "fuente": {
        "sitio": "cifraclub.com",
        "url": "https://www.cifraclub.com/los-redonditos-de-ricota/te-voy-a-atornillar/",
        "consultado": "2026-08-24",
        "ficha": "RES-49"
      }
    },
    {
      "slug": "superlogico",
      "titulo": "Superlógico",
      "desde": 4,
      "versos": [
        "Ahí van los machos para consumar",
        "Una hermosa dotación vital.",
        "El club de mantis muy nervioso está.",
        "Esas hembras no son dulces, no.",
        "Tal orgía van a banquetear.",
        "Sin descanso van a devorar.",
        "Superrígido, sí.",
        "Superrígido, sí, sí, sí."
      ],
      "dificultad": "dificil",
      "dificultadSegun": "youtube",
      "fuente": {
        "sitio": "cifraclub.com",
        "url": "https://www.cifraclub.com/los-redonditos-de-ricota/superlogico/",
        "consultado": "2026-08-24",
        "ficha": "RES-49"
      }
    },
    {
      "slug": "nam-fri-frufi-fali-fru",
      "titulo": "Ñam fri frufi fali fru",
      "desde": 1,
      "versos": [
        "Que está borracha por demás otra vez",
        "Me llama nene, doctor",
        "Yo no la cambio por nada",
        "Cuando empieza a cabalgar",
        "Que mordió el vidrio por demás otra vez",
        "Me llama nene, sifón",
        "Cuando me muerda alocada",
        "Aguanten LOS REDONDOS"
      ],
      "dificultad": "dificil",
      "dificultadSegun": "youtube",
      "fuente": {
        "sitio": "cifraclub.com",
        "url": "https://www.cifraclub.com/los-redonditos-de-ricota/nam-fri-frufi-fali-fru/",
        "consultado": "2026-08-24",
        "ficha": "RES-49"
      }
    },
    {
      "slug": "el-infierno-esta-encantador-esta-noche",
      "titulo": "El infierno está encantador esta noche",
      "desde": 2,
      "versos": [
        "pueden acaso vever el vino",
        "por ustedes enbasado",
        "Puede alguien decirme",
        "me voy a comer tu dolor",
        "y repetirme",
        "te voy a salvar esta noche",
        "El infierno esta encantador",
        "este infierno esta embriagador"
      ],
      "dificultad": "dificil",
      "dificultadSegun": "youtube",
      "fuente": {
        "sitio": "cifraclub.com",
        "url": "https://www.cifraclub.com/los-redonditos-de-ricota/el-infierno-esta-encantador-esta-noche/",
        "consultado": "2026-08-24",
        "ficha": "RES-49"
      }
    },
    {
      "slug": "preso-en-mi-ciudad",
      "titulo": "Preso en mi ciudad",
      "desde": 1,
      "versos": [
        "Ahora ya no llora...",
        "Casi ya no llora, ¡atrapado en libertad!",
        "Practicamos tiro al pichón",
        "y un test para ir al espacio",
        "con mi delicioso campeón",
        "y el rock como todo llanto",
        "Casi ya no llora,",
        "¡atrapado en libertad!"
      ],
      "dificultad": "dificil",
      "dificultadSegun": "youtube",
      "fuente": {
        "sitio": "lacuerda.net",
        "url": "https://acordes.lacuerda.net/patricio_rey/preso_en_mi_ciudad.shtml",
        "consultado": "2026-08-24"
      }
    },
    {
      "slug": "musica-para-pastillas",
      "titulo": "Música para pastillas",
      "desde": 5,
      "versos": [
        "La más hermosa niña del mundo",
        "Puede dar sólo lo que tiene para dar",
        "Y mucha cuchillería",
        "Pará, mi amor, esto está muy Shanghai",
        "Rockeros bonitos, educaditos",
        "Con grandes gastos, educaditos",
        "Emboquen el tiro libre",
        "Que los buenos volvieron"
      ],
      "dificultad": "dificil",
      "dificultadSegun": "youtube",
      "fuente": {
        "sitio": "cifraclub.com",
        "url": "https://www.cifraclub.com/los-redonditos-de-ricota/musica-para-pastillas/",
        "consultado": "2026-08-24",
        "ficha": "RES-49"
      }
    },
    {
      "slug": "semen-up",
      "titulo": "Semen-Up",
      "desde": 1,
      "versos": [
        "que es para mí la mejor manzana",
        "su estilo desprecia mi soñar",
        "con ella soy rico, gratis.",
        "La veo casi como un demonio",
        "y rasco la alfombra por su amor  ( Ay )",
        "Saludable y católica",
        "no le gusta que ande solo",
        "se ha montado en mi nariz"
      ],
      "dificultad": "dificil",
      "dificultadSegun": "youtube",
      "fuente": {
        "sitio": "cifraclub.com",
        "url": "https://www.cifraclub.com/los-redonditos-de-ricota/semen-up/",
        "consultado": "2026-08-24",
        "ficha": "RES-49"
      }
    },
    {
      "slug": "divina-tv-fuhrer",
      "titulo": "Divina TV. Führer",
      "desde": 1,
      "versos": [
        "Me estoy por ahogar, me voy a pique",
        "Me est  por hundir, mi fiel fantasma",
        "bu buuu",
        "Si no me protege el empleado mayor",
        "que proyecta todo el tiempo",
        "MI televisor",
        "Ser, promovido para navidad",
        "Como no se nos ocurrió."
      ],
      "dificultad": "dificil",
      "dificultadSegun": "youtube",
      "fuente": {
        "sitio": "lacuerda.net",
        "url": "https://acordes.lacuerda.net/patricio_rey/divina_tv_fuhrer.shtml",
        "consultado": "2026-08-24"
      }
    },
    {
      "slug": "motor-psico",
      "titulo": "Motor psico",
      "desde": 0,
      "versos": [
        "Un susurro muy especial",
        "Lo que debes, cómo puedes quedártelo.",
        "Junto a la hemoglobina me fui",
        "y ya no sangro más.",
        "De la nada a la gloria me voy",
        "Voy jugando de acuerdo al dolor",